<?xml version="1.0" encoding="UTF-8"?>

<program_params xmlns:xsi="http://www.w3.org/2001/XMLSchema-instance"
	xsi:noNamespaceSchemaLocation="program_params_schema.xsd">


<param>
	<name>input</name>
	<short_name>i</short_name>
	<help>input fits schema file (*.fsd)</help>
</param>

<param>
	<name>source_output_dir</name>
	<short_name>s</short_name>
	<value>src</value>
	<help>directory to store the source file</help>
</param>

<param>
	<name>header_output_dir</name>
	<short_name>o</short_name>
	<value>include</value>
	<help>directory to store the header file</help>
</param>

</program_params>